<?xml version="1.0" encoding="UTF-8" ?>
<faq xmlns:xsi="http://www.w3.org/2001/XMLSchema-instance" xsi:noNamespaceSchemaLocation="Ejercicio5.xsd">
    <info>
        <titulo>WINDOWS98? SOLO SI ME OBLIGAN!</titulo>
        <autor>Fernando Damián Lorenzo García</autor>
        <email>Fer@yahoo.es </email>
        <version>1.0</version>
        <fecha>1999-05-01</fecha>
    </info>
    <part>
        <q>
            <qtext>¿Por qué tengo que instalar W95?</qtext>
            <a> A mi también me parece una buena pregunta.</a>
        </q>
        <q>
            <qtext>Y de que me vale?</qtext>
            <a>Otra ingeniosa pregunta.</a>
        </q>
    </part>
</faq>